Symbol,Name,Last Sale,Net Change,% Change,Market Cap,Country,IPO Year,Volume,Sector,Industry
PSA^G,Public Storage Depositary Shares Each Representing 1/1000 of a 5.05% Cumulative Preferred Share of Beneficial Interest Series G,$26.11,0.03,0.115%,,United States,,16176,,
PSA^H,Public Storage Depositary Shares Each Representing 1/1000 of a  5.60% Cumulative Preferred  Share of Beneficial Interest Series H,$27.39,0.0428,0.157%,,United States,,77490,,
PSA^I,Public Storage Depositary Shares Each Representing 1/1000 of a 4.875% Cumulative Preferred Share of Beneficial Interest Series I par value $0.01 per share,$26.46,-0.02,-0.076%,,United States,,30961,,
PSA^J,Public Storage Depositary Shares Each Representing 1/1000 of a 4.700% Cumulative Preferred Share of Beneficial Interest Series J par value $0.01 per share,$26.22,0.03,0.115%,,United States,,41996,,
PSA^K,Public Storage Depositary Shares Each Representing 1/1000 of a 4.75% Cumulative Preferred Share of Beneficial Interest Series K,$26.77,0.12,0.45%,,United States,,4184,Consumer Services,Real Estate Investment Trusts
PSA^L,Public Storage Depositary Shares Each Representing 1/1000 of a 4.625% Cumulative Preferred Share of Beneficial Interest Series L par value $0.01 per share,$25.90,0.04,0.155%,,United States,,47647,Consumer Services,Real Estate Investment Trusts
PSA^M,Public Storage Depositary Shares Each Representing 1/1000 of a 4.125% Cumulative Preferred Share of Beneficial Interest Series M,$25.55,0.02,0.078%,,United States,,42058,,
PSA^N,Public Storage Depositary Shares Each Representing 1/1000 of a 3.875% Cumulative Preferred Share of Beneficial Interest Series N,$24.80,0.05,0.202%,,United States,,90549,,
PSA^O,Public Storage Depositary Shares Each Representing 1/1000 of a 3.900% Cumulative Preferred Share of Beneficial Interest Series O,$25.66,0.04,0.156%,,United States,,75473,,
PSB,PS Business Parks Inc. Common Stock,$146.93,3.39,2.362%,4038912340.00,United States,,73820,Consumer Services,Real Estate Investment Trusts
PSB^W,PS Business Parks Inc. Depositary Shares Each Representing 1/1000 of a Share of 5.20% Cumulative Preferred Stock Series W,$25.91,0.12,0.465%,,United States,,12171,,
PSB^X,PS Business Parks Inc. Depositary Shares Each Representing 1/1000 of a Share of 5.25% Cumulative Preferred Stock Series X,$25.82,0.19,0.741%,,United States,,10205,,
PSB^Y,PS Business Parks Inc. 5.20% Cumulative Preferred Stock Series Y,$25.78,0.15,0.585%,,United States,,8099,,
PSB^Z,PS Business Parks Inc. Depositary Shares Each Representing 1/1000 of a Share of 4.875% Cumulative Preferred Stock Series Z  par value $0.01 per share,$25.82,0.12,0.467%,,United States,,20447,,
PSF,Cohen & Steers Select Preferred and Income Fund Inc. Common Stock,$26.94,-0.01,-0.037%,323617747.00,,2010,15291,,
PSN,Parsons Corporation Common Stock,$36.52,0.50,1.388%,3738211376.00,,2019,621267,Technology,EDP Services
PSO,Pearson Plc Common Stock,$10.61,0.04,0.378%,7997076053.00,United Kingdom,,377563,Consumer Services,Books
PSTG,Pure Storage Inc. Class A Common Stock,$20.67,0.47,2.327%,5639003143.00,,2015,11462446,Technology,Electronic Components
PSTH,Pershing Square Tontine Holdings Ltd. Class A Common Stock,$28.00,2.56,10.063%,5600002800.00,,2020,14511149,Finance,Business Services
PSTL,Postal Realty Trust Inc. Class A Common Stock,$16.51,-0.40,-2.365%,218164098.00,,2019,73770,Consumer Services,Real Estate Investment Trusts
PSX,Phillips 66 Common Stock,$87.35,2.94,3.483%,38165491166.00,United States,,3366632,Energy,Integrated oil Companies
PSXP,Phillips 66 Partners LP Common Units representing limited partner interest in the Partnership,$30.73,0.37,1.219%,7016892687.00,United States,2013,1258236,Energy,Natural Gas Distribution
PTA,Cohen & Steers Tax-Advantaged Preferred Securities and Income Fund Common Shares of Beneficial Interest,$24.86,-0.14,-0.56%,0.00,,2020,62414,,
PTR,PetroChina Company Limited Common Stock,$39.12,2.08,5.616%,71597806515.00,China,,480479,Energy,Oil & Gas Production
PTY,Pimco Corporate & Income Opportunity Fund,$17.97,0.02,0.111%,1908435834.00,United States,2002,390343,,
PUK,Prudential Public Limited Company Common Stock,$41.62,0.85,2.085%,54304066001.00,United Kingdom,,623845,Finance,Life Insurance
PUK^,Prudential Public Limited Company 6.75% Perpetual Subordinated Captial Security,$26.94,0.29,1.088%,,United Kingdom,,8403,,
PUK^A,Prudential Public Limited Company 6.50% Perpetual Subordinated Capital Securities Exchangeable at the Issuer's Option Into Non-Cumulative Dollar Denominated Preference Shares,$26.27,-0.36,-1.352%,,United Kingdom,,17995,,
PUMP,ProPetro Holding Corp. Common Stock,$13.14,1.21,10.142%,1325993890.00,United States,2017,1661471,Energy,Oilfield Services/Equipment
PVG,Pretium Resources Inc. Ordinary Shares (Canada),$10.11,0.13,1.303%,1894943303.00,Canada,,933169,Basic Industries,Precious Metals
PVH,PVH Corp. Common Stock,$104.39,4.84,4.862%,7422155098.00,United States,,1089879,Consumer Non-Durables,Apparel
PVL,Permianville Royalty Trust Trust Units ,$1.44,0.04,2.857%,47520000.00,United States,2011,317326,Energy,Oil & Gas Production
PWR,Quanta Services Inc. Common Stock,$83.12,1.29,1.576%,11500899382.00,United States,,1650179,Capital Goods,Engineering & Construction
PXD,Pioneer Natural Resources Company Common Stock,$163.59,5.02,3.166%,35430368005.00,United States,,3494114,Energy,Oil & Gas Production
PYN,PIMCO New York Municipal Income Fund III Common Shares of Beneficial Interest,$9.23,-0.12,-1.283%,52870280.00,United States,2002,4845,,
PYS,Merrill Lynch Depositor Inc PPlus Tr Ser RRD-1 Tr Ctf Cl A,$20.42,0.00,0.00%,0.00,United States,,96,Finance,Finance: Consumer Services
PYT,PPlus Tr GSC-2 Tr Ctf Fltg Rate,$24.00,0.3772,1.597%,0.00,United States,,10000,Finance,Finance: Consumer Services
PZC,PIMCO California Municipal Income Fund III Common Shares of Beneficial Interest,$10.38,0.12,1.17%,232239380.00,United States,2002,23644,,
PZN,Pzena Investment Management Inc Class A Common Stock,$10.46,0.26,2.549%,744437855.00,United States,2007,74082,Finance,Investment Managers
QD,Qudian Inc. American Depositary Shares each representing one Class A Ordinary Share,$2.18,-0.19,-8.017%,553129981.00,China,2017,9977852,Finance,Finance: Consumer Services
QEP,QEP Resources Inc. Common Stock,$4.28,0.20,4.902%,1038181718.00,United States,,9249664,Energy,Oil & Gas Production
QGEN,Qiagen N.V. Common Shares ,$47.52,-0.06,-0.126%,10833847200.00,Netherlands,,693709,Health Care,Biotechnology: Biological Products (No Diagnostic Substances)
QS,QuantumScape Corporation Class A Common Stock,$44.39,0.49,1.116%,16271876725.00,United States,2020,16572081,Miscellaneous,Industrial Machinery/Components
QSR,Restaurant Brands International Inc. Common Shares,$62.47,-0.12,-0.192%,18935485290.00,Canada,2014,2754490,Consumer Services,Restaurants
QTS,QTS Realty Trust Inc. Class A Common Stock,$59.06,1.94,3.396%,3817936358.00,United States,2013,822802,Consumer Services,Real Estate Investment Trusts
QTS^A,QTS Realty Trust Inc. 7.125% Series A Cumulative Redeemable Perpetual Preferred Stock,$27.4005,0.1005,0.368%,,United States,,2810,,
QTS^B,QTS Realty Trust Inc. 6.50% Series B Cumulative Convertible Perpetual Preferred Stock,$129.53,-1.98,-1.506%,,United States,,60143,,
QTWO,Q2 Holdings Inc. Common Stock,$109.26,-0.04,-0.037%,6074802681.00,,2014,1093495,Technology,Computer Software: Prepackaged Software
QUAD,Quad Graphics Inc Class A Common Stock,$5.06,0.09,1.811%,271501941.00,United States,,191270,Miscellaneous,Publishing
QUOT,Quotient Technology Inc. Common Stock,$14.26,0.46,3.333%,1320172661.00,,2014,1065907,Consumer Services,Advertising
QVCC,QVC Inc. 6.250% Senior Secured Notes due 2068,$25.29,0.05,0.198%,0.00,United States,2019,22819,Consumer Services,Catalog/Specialty Distribution
QVCD,QVC Inc. 6.375% Senior Secured Notes due 2067,$25.30,0.0634,0.251%,0.00,United States,2018,12755,Consumer Services,Catalog/Specialty Distribution
R,Ryder System Inc. Common Stock,$72.93,2.41,3.417%,3916192296.00,United States,,403792,Consumer Services,Rental/Leasing Companies
RA,Brookfield Real Assets Income Fund Inc. Common Stock,$20.53,0.11,0.539%,901068126.00,,2016,613069,,
RAAS,Cloopen Group Holding Limited American Depositary Shares each representing two Class A Ordinary Shares,$19.75,1.98,11.142%,3156944695.00,,2021,2248242,Technology,Computer Software: Prepackaged Software
RACE,Ferrari N.V. Common Shares,$188.90,1.12,0.596%,46865109987.00,,2015,350517,Capital Goods,Auto Manufacturing
RAD,Rite Aid Corporation Common Stock,$19.59,-0.01,-0.051%,1081845271.00,United States,,2197273,Health Care,Medical/Nursing Services
RAMP,LiveRamp Holdings Inc. Common Stock,$52.56,-2.40,-4.367%,3517284242.00,United States,2018,1534368,Technology,EDP Services
RBA,Ritchie Bros. Auctioneers Incorporated Common Stock,$54.33,3.21,6.279%,5971325708.00,Canada,,1005842,Miscellaneous,Business Services
RBAC,RedBall Acquisition Corp. Class A Ordinary Shares,$10.24,0.08,0.787%,736000000.00,United States,2020,1262853,Finance,Business Services
RBC,Regal Beloit Corporation Common Stock,$138.70,2.73,2.008%,5632111286.00,United States,,445892,Consumer Durables,Metal Fabrications
RC,Ready Capital Corproation Common Stock,$13.69,0.38,2.855%,756250358.00,United States,2013,742594,Consumer Services,Real Estate Investment Trusts
RCA,Ready Capital Corporation 7.00% Convertible Senior Notes due 2023,$25.85,0.105,0.408%,0.00,United States,2017,3747,Consumer Services,Real Estate Investment Trusts
RCB,Ready Capital Corporation 6.20% Senior Notes due 2026,$25.75,0.02,0.078%,0.00,United States,2019,18927,Consumer Services,Real Estate Investment Trusts
RCC,Ready Capital Corporation 5.75% Senior Notes due 2026,$25.50,-0.45,-1.734%,,United States,2021,14461,Consumer Services,Real Estate Investment Trusts
RCI,Rogers Communication Inc. Common Stock,$47.10,1.86,4.111%,23781982478.00,Canada,,738680,Consumer Services,Television Services
RCL,D/B/A Royal Caribbean Cruises Ltd. Common Stock,$86.51,-5.10,-5.567%,20556590115.00,United States,1993,9541821,Consumer Services,Marine Transportation
RCP,Ready Capital Corporation 6.50% Senior Notes due 2021,$25.22,0.00,0.00%,0.00,United States,2018,2010,Consumer Services,Real Estate Investment Trusts
RCS,PIMCO Strategic Income Fund Inc.,$7.32,0.06,0.826%,321611520.00,United States,1994,133875,,
RCUS,Arcus Biosciences Inc. Common Stock,$34.01,0.62,1.857%,2410500310.00,,2018,625361,Health Care,Major Pharmaceuticals
RDN,Radian Group Inc. Common Stock,$21.36,0.32,1.521%,4094474135.00,United States,,2521573,Finance,Property-Casualty Insurers
RDS/B,Royal Dutch Shell PLC,$41.75,1.34,3.316%,,Netherlands,,4168954,,
RDY,Dr. Reddy's Laboratories Ltd Common Stock,$61.30,-0.48,-0.777%,10172064685.00,India,,263468,Health Care,Major Pharmaceuticals
RE,Everest Re Group Ltd. Common Stock,$246.90,7.22,3.012%,9873941348.00,Bermuda,,219387,Finance,Property-Casualty Insurers
RELX,RELX PLC PLC American Depositary Shares (Each representing One Ordinary Share),$23.82,0.14,0.591%,46032008986.00,United Kingdom,2015,688342,Miscellaneous,Business Services
RENN,Renren Inc. American Depositary Shares each representing fifteen Class A ordinary shares,$6.51,0.09,1.402%,153504771.00,China,2011,156731,Consumer Durables,Automotive Aftermarket
RES,RPC Inc. Common Stock,$7.18,0.63,9.618%,1549614877.00,United States,,1830364,Energy,Oilfield Services/Equipment
REV,Revlon Inc. New Common Stock,$11.47,0.30,2.686%,611730359.00,United States,1996,337053,Consumer Non-Durables,Package Goods/Cosmetics
REVG,REV Group Inc. Common Stock,$13.39,0.64,5.02%,854477989.00,United States,2017,302051,Capital Goods,Auto Manufacturing
REX,REX American Resources Corporation,$109.61,12.71,13.117%,656783339.00,United States,,37339,Basic Industries,Major Chemicals
REXR,Rexford Industrial Realty Inc. Common Stock,$47.59,1.00,2.146%,6254749655.00,United States,2013,519882,Consumer Services,Real Estate Investment Trusts
REXR^A,Rexford Industrial Realty Inc. 5.875% Series A Cumulative Redeemable Preferred Stock,$25.3688,0.0388,0.153%,,United States,,5270,,
REXR^B,Rexford Industrial Realty Inc. 5.875% Series B Cumulative Redeemable Preferred Stock,$25.75,0.15,0.586%,,United States,,2272,,
REXR^C,Rexford Industrial Realty Inc. 5.625% Series C Cumulative Redeemable Preferred Stock par value $0.01 per share,$25.90,0.12,0.465%,,United States,,386,,
REZI,Resideo Technologies Inc. Common Stock ,$29.36,1.11,3.929%,4202574986.00,,2018,2475989,Capital Goods,Wholesale Distributors
RF,Regions Financial Corporation Common Stock,$20.91,0.65,3.208%,20087694009.00,United States,,15265458,Finance,Major Banks
RF^A,Regions Financial Corporation Depositary Shares Representing 1/40th Perpetual Preferred Series A,$25.63,0.1151,0.451%,,United States,,46394,,
RF^B,Regions Financial Corporation Depositary Shares Representing 1/40th Perpetual Preferred Series B,$27.75,0.4028,1.473%,,United States,,18849,,
RF^C,Regions Financial Corporation Depositary Shares each Representing a 1/40th Interest in a  Share of 5.700% Fixed-to-Floating Rate Non-Cumulative  Perpetual Preferred Stock Series C,$27.56,0.31,1.138%,,United States,,17143,,
RFI,Cohen & Steers Total Return Realty Fund Inc. Common Stock,$14.08,0.13,0.932%,369143977.00,United States,1993,52216,,
RFL,Rafael Holdings Inc. Class B Common Stock,$30.76,-0.37,-1.189%,512819523.00,United States,2018,102328,Finance,Real Estate
RFM,RiverNorth Flexible Municipal Income Fund Inc. Common Stock,$22.16,0.16,0.727%,141231619.00,,2020,12995,,
RFMZ,RiverNorth Flexible Municipal Income Fund II Inc. Common Stock,$20.03,0.00,0.00%,0.00,,2021,37307,,
RFP,Resolute Forest Products Inc. Common Stock,$9.57,0.40,4.362%,773256000.00,Canada,,397790,Basic Industries,Paper
RGA,Reinsurance Group of America Incorporated Common Stock,$125.45,1.93,1.563%,8527209839.00,United States,,738163,Finance,Life Insurance
RGR,Sturm Ruger & Company Inc. Common Stock,$66.21,1.05,1.611%,1161654450.00,United States,,301254,Capital Goods,Ordnance And Accessories
RGS,Regis Corporation Common Stock,$11.63,-0.73,-5.906%,450774916.00,United States,1991,484528,Consumer Services,Other Consumer Services
RGT,Royce Global Value Trust Inc. Common Stock,$13.68,-0.15,-1.085%,143687470.00,,2013,23162,,
RH,RH Common Stock,$449.02,2.09,0.468%,9160650548.00,United States,2012,607491,Consumer Services,Other Specialty Stores
RHI,Robert Half International Inc. Common Stock,$76.92,1.12,1.478%,8701563770.00,United States,,1287779,Technology,Professional Services
RHP,Ryman Hospitality Properties Inc. (REIT),$80.32,1.19,1.504%,4416276808.00,United States,,839144,Consumer Services,Real Estate Investment Trusts
RICE,Rice Acquisition Corp. Class A Common Stock,$10.24,0.15,1.487%,306266624.00,United States,2020,170227,Finance,Business Services
RIG,Transocean Ltd (Switzerland) Common Stock,$4.26,0.16,3.902%,2624267113.00,Switzerland,,46246941,Energy,Oil & Gas Production
RIO,Rio Tinto Plc Common Stock,$83.64,1.74,2.125%,135404119101.00,Australia,2002,3643482,Basic Industries,Precious Metals
RIV,RiverNorth Opportunities Fund Inc. Common Stock,$17.12,-0.1299,-0.753%,160756800.00,,2015,109571,,
RJF,Raymond James Financial Inc. Common Stock,$117.57,0.88,0.754%,16190700141.00,United States,,904885,Finance,Investment Bankers/Brokers/Service
RKT,Rocket Companies Inc. Class A Common Stock,$25.10,-1.76,-6.552%,49809746405.00,United States,2020,34965960,Finance,Finance: Consumer Services
RL,Ralph Lauren Corporation Common Stock,$122.20,1.23,1.017%,8935064325.00,United States,1997,1473794,Consumer Non-Durables,Apparel
RLGY,Realogy Holdings Corp. Common Stock,$14.68,1.59,12.147%,1695490088.00,United States,2012,2294657,Finance,Real Estate
RLH,Red Lions Hotels Corporation Common Stock,$3.48,0.00,0.00%,88744367.00,United States,,71275,Consumer Services,Hotels/Resorts
RLI,RLI Corp. Common Stock (DE),$109.13,3.41,3.226%,4927148675.00,United States,,140976,Finance,Property-Casualty Insurers
RLJ,RLJ Lodging Trust Common Shares of Beneficial Interest $0.01 par value,$15.52,0.28,1.837%,2560842711.00,United States,2011,849901,Consumer Services,Real Estate Investment Trusts
RLJ^A,RLJ Lodging Trust $1.95 Series A Cumulative Convertible  Preferred Shares,$25.55,0.02,0.078%,,United States,,119276,,
RLX,RLX Technology Inc. American Depositary Shares each representing the right to receive one (1) Class A ordinary share,$16.09,-0.54,-3.247%,24992847521.00,,2021,9085564,Consumer Non-Durables,Farming/Seeds/Milling
RM,Regional Management Corp. Common Stock,$36.73,1.45,4.11%,399121403.00,United States,2012,107165,Finance,Finance: Consumer Services
RMAX,RE/MAX Holdings Inc. Class A Common Stock,$38.95,1.10,2.906%,1212740267.00,,2013,117627,Finance,Real Estate
RMD,ResMed Inc. Common Stock,$185.05,2.00,1.093%,26926455994.00,United States,,966175,Health Care,Medical/Dental Instruments
RMI,RiverNorth Opportunistic Municipal Income Fund Inc. Common Stock,$21.23,-0.17,-0.794%,135304480.00,,2018,10918,,
RMM,RiverNorth Managed Duration Municipal Income Fund Inc. Common Stock,$18.19,0.29,1.62%,359061814.00,,2019,33353,,
RMO,Romeo Power Inc. Class A Common Stock,$9.68,-0.73,-7.012%,1227299622.00,,2019,10667129,Capital Goods,Auto Parts:O.E.M.
RMPL^,RiverNorth Specialty Finance Corporation 5.875% ,$25.35,0.0099,0.039%,,,,1259,,
RMT,Royce Micro-Cap Trust Inc. Common Stock,$11.47,0.05,0.438%,494344716.00,United States,,204235,,
RNG,RingCentral Inc. Class A Common Stock,$321.36,-8.16,-2.476%,29080681690.00,,2013,2008863,Technology,EDP Services
RNGR,Ranger Energy Services Inc. Class A Common Stock,$5.94,0.19,3.304%,91445801.00,United States,2017,8132,Energy,Oilfield Services/Equipment
RNP,Cohen & Steers REIT and Preferred and Income Fund Inc. Common Shares,$22.72,-0.09,-0.395%,1081067425.00,United States,2003,107570,,
RNR,RenaissanceRe Holdings Ltd. Common Stock,$164.38,4.17,2.603%,8336452798.00,Bermuda,,392480,Finance,Property-Casualty Insurers
RNR^E,RenaissanceRe Holdings Ltd. 5.375% Series E Preference Shares,$25.27,0.04,0.159%,,Bermuda,,9123,,
RNR^F,RenaissanceRe Holdings Ltd. Depositary Shares each Representing a 1/1000th Interest in a 5.750% Series F Preference Share,$26.67,0.05,0.188%,,Bermuda,,21434,,
ROG,Rogers Corporation Common Stock,$181.84,-3.70,-1.994%,3400371814.00,United States,,110560,Basic Industries,Major Chemicals
ROK,Rockwell Automation Inc. Common Stock,$253.09,7.02,2.853%,29397689450.00,United States,,575265,Capital Goods,Industrial Machinery/Components
ROL,Rollins Inc. Common Stock,$32.94,1.04,3.26%,16211155042.00,United States,,1169389,Finance,Diversified Commercial Services
ROP,Roper Technologies Inc. Common Stock,$376.94,5.05,1.358%,39555931693.00,United States,1992,637081,Capital Goods,Industrial Machinery/Components
RPAI,Retail Properties of America Inc. Class A Common Stock,$11.34,0.30,2.717%,2433715298.00,United States,2012,1787275,Consumer Services,Real Estate Investment Trusts
RPLA,Replay Acquisition Corp. Ordinary Shares,$10.18,0.03,0.296%,365843750.00,,2019,382912,Finance,Business Services
RPM,RPM International Inc. Common Stock,$83.52,3.15,3.919%,10866184603.00,United States,,659503,Basic Industries,Paints/Coatings
RPT,RPT Realty Common Stock,$11.61,0.17,1.486%,943016817.00,United States,,580225,Consumer Services,Real Estate Investment Trusts
RPT^D,RPT Realty 7.25% ,$54.251,0.0899,0.166%,,United States,,6262,,
RQI,Cohen & Steers Quality Income Realty Fund Inc Common Shares,$12.88,0.14,1.099%,1729052790.00,United States,2002,540124,,
RRC,Range Resources Corporation Common Stock,$10.56,0.22,2.128%,2730508155.00,United States,,6341779,Energy,Oil & Gas Production
RRD,R.R. Donnelley & Sons Company Common Stock,$4.02,0.15,3.876%,287074487.00,United States,,1520008,Miscellaneous,Publishing
RS,Reliance Steel & Aluminum Co. Common Stock (DE),$140.27,3.73,2.732%,8921438794.00,United States,1994,439084,Basic Industries,Metal Fabrications
RSF,RiverNorth Specialty Finance Corporation,$17.67,0.1023,0.582%,96588903.00,,2019,17021,,
RSG,Republic Services Inc. Common Stock,$94.45,3.06,3.348%,30119945663.00,United States,1998,1759251,Public Utilities,Environmental Services
RSI,Rush Street Interactive Inc. Class A Common Stock,$15.90,-0.26,-1.609%,3256208732.00,,2020,1362833,Consumer Services,Services-Misc. Amusement & Recreation
RTP,Reinvent Technology Partners Class A Ordinary Shares,$11.02,0.37,3.474%,950475000.00,United States,2020,4107552,Finance,Business Services
RTPZ,Reinvent Technology Partners Z Class A Ordinary Shares,$10.70,0.25,2.392%,307625000.00,United States,2021,1084006,Finance,Business Services
RTX,Raytheon Technologies Corporation Common Stock,$75.18,0.76,1.021%,114234366114.00,United States,,6661162,Capital Goods,Aerospace
RVI,Retail Value Inc. Common Stock ,$15.89,-0.11,-0.688%,315087005.00,United States,2018,251070,Finance,Real Estate
RVLV,Revolve Group Inc. Class A Common Stock,$44.67,2.13,5.007%,3201298555.00,,2019,1758257,Consumer Services,Catalog/Specialty Distribution
RVT,Royce Value Trust Inc. Common Stock,$17.86,0.15,0.847%,1794424580.00,United States,1986,238811,,
RWT,Redwood Trust Inc. Common Stock,$9.77,-0.15,-1.512%,1095119359.00,United States,1995,1294023,Consumer Services,Real Estate Investment Trusts
RXN,Rexnord Corporation Common Stock,$47.71,2.45,5.413%,5705771009.00,United States,2012,1043953,Technology,Industrial Machinery/Components
RY,Royal Bank Of Canada Common Stock,$88.92,2.14,2.466%,126697955080.00,Canada,,2771568,Finance,Commercial Banks
RY^T,Royal Bank Of Canada 6.750% Fixed Rate/Floating Rate Noncumulative First Preferred Shares Series C-2,$28.7818,0.00,0.00%,,Canada,,105,,
RYAM,Rayonier Advanced Materials Inc. Common Stock,$9.74,0.53,5.755%,616979979.00,United States,2014,717167,Basic Industries,Paper
RYB,RYB Education Inc. American depositary shares each representing one Class A ordinary share,$3.04,-0.12,-3.797%,83862492.00,,2017,113133,Consumer Services,Other Consumer Services
RYI,Ryerson Holding Corporation Common Stock,$14.46,0.60,4.329%,551177561.00,United States,2014,165009,Basic Industries,Metal Fabrications
RYN,Rayonier Inc. REIT Common Stock,$32.97,0.65,2.011%,4544159817.00,United States,,440314,Consumer Services,Real Estate Investment Trusts
RZA,Reinsurance Group of America Incorporated 6.20% Fixed-to-Floating Rate Subordinated Debentures due 2042,$26.40,0.2499,0.956%,0.00,United States,,18273,Finance,Life Insurance
RZB,Reinsurance Group of America Incorporated 5.75% Fixed-To-Floating Rate Subordinated Debentures due 2056,$28.09,0.23,0.826%,0.00,United States,2016,14526,Finance,Life Insurance
SA,Seabridge Gold Inc. Ordinary Shares (Canada),$16.42,-0.10,-0.605%,1217881580.00,Canada,,504376,Basic Industries,Precious Metals
SAF,Saratoga Investment Corp 6.25% Notes due 2023,$25.43,-0.0499,-0.196%,0.00,United States,2018,952,,
SAFE,Safehold Inc. Common Stock,$69.90,1.28,1.865%,3722170736.00,United States,2017,119847,Consumer Services,Real Estate
SAH,Sonic Automotive Inc. Common Stock,$47.80,1.08,2.312%,1999335476.00,United States,1997,491111,Consumer Durables,Automotive Aftermarket
SAIC,SCIENCE APPLICATIONS INTERNATIONAL CORPORATION Common Stock,$88.26,2.18,2.533%,5138878836.00,,,380143,Technology,EDP Services
SAIL,SailPoint Technologies Holdings Inc. Common Stock,$52.19,-1.64,-3.047%,4771719644.00,United States,2017,2014422,Technology,Computer Software: Prepackaged Software
SAK,Saratoga Investment Corp 7.25% Notes due 2025,$26.42,-0.0068,-0.026%,0.00,United States,2020,1609,,
SAM,Boston Beer Company Inc. (The) Common Stock,$1088.32,57.51,5.579%,13349719474.00,United States,,136310,Consumer Non-Durables,Beverages (Production/Distribution)
SAN,Banco Santander S.A. Sponsored ADR (Spain),$3.68,0.15,4.249%,63710098330.00,Spain,,10480818,Finance,Commercial Banks
SAND          ,Sandstorm Gold Ltd. Ordinary Shares (Canada),$6.35,0.25,4.098%,1239858093.00,Canada,,2192500,Basic Industries,Precious Metals
SAP,SAP  SE ADS,$123.08,1.04,0.852%,146914426984.00,Germany,,1146072,Technology,Computer Software: Prepackaged Software
SAR,Saratoga Investment Corp New,$22.77,-0.14,-0.611%,254341538.00,United States,,59803,,
SAVE,Spirit Airlines Inc. Common Stock,$34.42,-0.44,-1.262%,3365700566.00,United States,,6439858,Transportation,Air Freight/Delivery Services
SB,Safe Bulkers Inc Common Stock ($0.001 par value),$2.75,0.02,0.733%,281043593.00,Monaco,2008,620406,Transportation,Marine Transportation
SB^C,Safe Bulkers Inc Cumulative Redeemable Perpetual Preferred Series C (Marshall Islands),$22.05,-0.135,-0.609%,,Monaco,,1025,,
SB^D,Safe Bulkers Inc Perpetual Preferred Series D (Marshall Islands),$22.16,0.06,0.271%,,Monaco,,2623,,
SBBA,Scorpio Tankers Inc. 7.00% Senior Notes due 2025,$25.00,-0.10,-0.398%,0.00,Monaco,2020,10176,Transportation,Marine Transportation
SBG,Sandbridge Acquisition Corporation Class A Common Stock,$10.05,0.08,0.802%,288937500.00,,2020,595215,Finance,Business Services
SBH,Sally Beauty Holdings Inc. (Name to be changed from Sally Holdings Inc.) Common Stock,$18.26,0.59,3.339%,2059989775.00,United States,,2265286,Consumer Services,Other Specialty Stores
SBI,Western Asset Intermediate Muni Fund Inc Common Stock,$9.12,-0.0272,-0.297%,128430713.00,United States,1992,14696,,
SBOW,SilverBow Resorces Inc. Common Stock,$8.15,0.13,1.621%,97283934.00,,,44047,Energy,Oil & Gas Production
SBR,Sabine Royalty Trust Common Stock,$33.00,0.25,0.763%,481118385.00,United States,,99980,Energy,Oil & Gas Production
SBS,Companhia de saneamento Basico Do Estado De Sao Paulo - Sabesp American Depositary Shares (Each repstg 250 Common Shares),$6.65,-0.09,-1.335%,4545340629.00,Brazil,2002,3076368,Public Utilities,Water Supply
SBSW,D/B/A Sibanye-Stillwater Limited ADS,$19.51,0.30,1.562%,14259715133.00,,,2600842,,
SC,Santander Consumer USA Holdings Inc. Common Stock,$26.02,-0.46,-1.737%,7963966691.00,,2014,1477443,Finance,Finance: Consumer Services
