Symbol,Name,Last Sale,Net Change,% Change,Market Cap,Country,IPO Year,Volume,Sector,Industry
IVR^A,Invesco Mortgage Capital Inc. Pfd Ser A,$24.62,0.1235,0.504%,,United States,,20376,,
IVR^B,Invesco Mortgage Capital Inc. Preferred Series B Cum Fxd to Fltg,$23.46,-0.31,-1.304%,,United States,,25662,,
IVR^C,INVESCO MORTGAGE CAPITAL INC 7.5% Fixed-to-Floating Series C Cumulative Redeemable Preferred Stock Liquation Preference $25.00 per Share,$24.0438,-0.0062,-0.026%,,United States,,9020,,
IVZ,Invesco Ltd Common Stock,$23.76,0.44,1.887%,10907556945.00,United States,,9183118,Finance,Investment Managers
IX,Orix Corp Ads Common Stock,$85.41,1.09,1.293%,20831372935.00,Japan,,39027,Finance,Diversified Financial Services
J,Jacobs Engineering Group Inc. Common Stock,$115.52,2.64,2.339%,15027553319.00,United States,,624714,Basic Industries,Military/Government/Technical
JAX,J. Alexander's Holdings Inc. Common Stock,$8.75,0.12,1.39%,131863174.00,,2015,36055,Consumer Services,Restaurants
JBGS,JBG SMITH Properties Common Shares ,$32.37,0.17,0.528%,4259919773.00,United States,2017,358289,Consumer Services,Real Estate Investment Trusts
JBK,Lehman ABS 3.50 3.50% Adjustable Corp Backed Tr Certs GS Cap I,$29.25,0.45,1.563%,0.00,United States,,401,Finance,Finance: Consumer Services
JBL,Jabil Inc. Common Stock,$43.36,1.30,3.091%,6511631317.00,United States,1993,1033633,Technology,Electrical Products
JBT,John Bean Technologies Corporation Common Stock,$144.50,3.75,2.664%,4584946852.00,United States,,326830,Technology,Industrial Machinery/Components
JCE,Nuveen Core Equity Alpha Fund Nuveen Core Equity Alpha Fund Common Shares of Beneficial Interest,$14.46,0.10,0.696%,231783403.00,United States,2007,24062,,
JCI,Johnson Controls International plc Ordinary Share,$59.20,1.93,3.37%,42527581434.00,Switzerland,,5304317,Consumer Services,Other Consumer Services
JCO,Nuveen Credit Opportunities 2022 Target Term Fund Common Shares of Beneficial Interest,$8.27,-0.03,-0.361%,229417516.00,United States,2017,76975,,
JDD,Nuveen Diversified Dividend and Income Fund Shares of Beneficial Interest,$9.11,0.08,0.886%,179799670.00,United States,2003,68742,,
JE,Just Energy Group Inc. Ordinary Shares (Canada),$3.90,-0.11,-2.743%,187506684.00,Canada,,2598013,Public Utilities,Oil/Gas Transmission
JEF,Jefferies Financial Group Inc. Common Stock,$30.53,0.80,2.691%,7632131137.00,United States,,1700583,Finance,Investment Bankers/Brokers/Service
JELD,JELD-WEN Holding Inc. Common Stock,$27.72,1.97,7.65%,2795169790.00,United States,2017,1285957,Basic Industries,Forest Products
JEMD,Nuveen Emerging Markets Debt 2022 Target Term Fund Common Shares of Beneficial Interest $0.01 par value per share,$7.85,-0.02,-0.254%,111825315.00,,2017,12592,,
JEQ,Aberdeen Japan Equity Fund Inc.  Common Stock,$8.88,-0.14,-1.552%,119067800.00,United States,1992,20838,,
JFR,Nuveen Floating Rate Income Fund Common Stock,$9.52,0.15,1.601%,541863815.00,United States,2004,1060234,,
JGH,Nuveen Global High Income Fund Common Shares of Beneficial Interest,$15.23,-0.12,-0.782%,352991695.00,United States,2014,27109,,
JHAA,Nuveen Corporate Income 2023 Target Term Fund,$9.96,0.01,0.101%,77931263.00,,2018,48883,,
JHB,Nuveen Corporate Income November 2021 Target Term Fund,$9.33,-0.02,-0.214%,521547457.00,,2016,71257,,
JHG,Janus Henderson Group plc Ordinary Shares,$29.86,1.06,3.681%,5146370672.00,,2017,1340541,Finance,Investment Managers
JHI,John Hancock Investors Trust Common Stock,$17.9699,0.2099,1.182%,156464369.00,United States,,12051,,
JHS,John Hancock Income Securities Trust Common Stock,$15.84,0.1247,0.793%,184481891.00,United States,,11140,,
JHX,James Hardie Industries plc American Depositary Shares (Ireland),$28.97,-0.31,-1.059%,12867532156.00,Ireland,,37828,Capital Goods,Building Materials
JIH,Juniper Industrial Holdings Inc. Class A Common Stock,$12.86,0.37,2.962%,554587500.00,,2019,1981520,Finance,Business Services
JILL,J. Jill Inc. Common Stock,$4.33,-0.61,-12.348%,41653951.00,,2017,624723,Consumer Non-Durables,Apparel
JKS,JinkoSolar Holding Company Limited American Depositary Shares (each representing 4 Common Shares),$42.45,1.55,3.79%,1922723890.00,China,2010,3554922,Technology,Semiconductors
JLL,Jones Lang LaSalle Incorporated Common Stock,$177.18,3.21,1.845%,9055806229.00,United States,,427297,Finance,Real Estate
JLS,Nuveen Mortgage and Income Fund,$20.40,0.0177,0.087%,111943776.00,United States,2009,16118,,
JMIA,Jumia Technologies AG American Depositary Shares each representing two Ordinary Shares,$37.33,-1.11,-2.888%,3329710534.00,,2019,11652760,Consumer Services,Catalog/Specialty Distribution
JMM,Nuveen Multi-Market Income Fund (MA),$7.18,0.02,0.279%,67939673.00,United States,,7307,,
JMP,JMP Group LLC Common Shares,$5.26,-0.08,-1.498%,104095400.00,United States,2007,86367,Finance,Investment Bankers/Brokers/Service
JNJ,Johnson & Johnson Common Stock,$156.10,3.03,1.979%,410336920526.00,United States,,8326580,Health Care,Major Pharmaceuticals
JNPR,Juniper Networks Inc. Common Stock,$23.81,0.18,0.762%,7813777677.00,United States,1999,6250634,Technology,Computer Communications Equipment
JOE,St. Joe Company (The) Common Stock,$46.73,0.04,0.086%,2751581515.00,United States,,406646,Consumer Services,Homebuilding
JOF,Japan Smaller Capitalization Fund Inc Common Stock,$9.01,0.02,0.222%,255288376.00,United States,1990,44293,,
JP,Jupai Holdings Limited American Depositary Shares each representing six ordinary shares,$2.39,-0.01,-0.417%,80577218.00,,2015,64861,Consumer Services,Other Consumer Services
JPC,Nuveen Preferred & Income Opportunities Fund,$9.14,0.03,0.329%,944666062.00,United States,2003,388862,,
JPI,Nuveen Preferred and Income Term Fund Common Shares of Beneficial Interest,$24.20,0.09,0.373%,550825662.00,,2012,67968,,
JPM,JP Morgan Chase & Co. Common Stock,$150.91,0.35,0.232%,460502836257.00,United States,,18460610,Finance,Major Banks
JPM^C,J P Morgan Chase & Co Depositary Shares each representing a 1/400th interest in a share of 6.00% Non-Cumulative  Preferred Stock Series EE,$27.22,0.07,0.258%,,United States,,85751,,
JPM^D,J P Morgan Chase & Co Depositary Shares each representing a 1/400th  interest in a share of 5.75% Non-Cumulative  Preferred Stock Series DD,$26.76,0.08,0.30%,,United States,,83492,,
JPM^G,J P Morgan Chase & Co Depositary Shares each representing a 1/400th interest in a share of 6.10% Non-Cumulative Preferred Stock Series AA,$25.59,0.0577,0.226%,,United States,,59680,,
JPM^H,J P Morgan Chase & Co Depositary Shares each representing a 1/400th interest in a share of 6.15% Non-Cumulative Preferred Stock Series BB,$25.56,0.06,0.235%,,United States,,41349,Finance,Major Banks
JPM^J,J P Morgan Chase & Co Depositary Shares each representing a 1/400th interest in a share of JPMorgan Chase & Co. 4.75% Non-Cumulative Preferred Stock Series GG,$26.20,0.16,0.614%,,United States,,71357,Finance,Major Banks
JPS,Nuveen Preferred & Income Securities Fund,$9.39,0.00,0.00%,1913492961.00,United States,2002,379674,,
JPT,Nuveen Preferred and Income 2022 Term Fund Common Shares of Beneficial Interest,$24.0727,-0.069,-0.286%,164637528.00,United States,2017,5104,,
JQC,Nuveen Credit Strategies Income Fund Shares of Beneficial Interest,$6.46,0.07,1.095%,876036013.00,United States,2003,904131,,
JRI,Nuveen Real Asset Income and Growth Fund Common Shares of Beneficial Interest,$14.41,-0.01,-0.069%,395830884.00,United States,2012,70115,,
JRO,Nuveen Floating Rate Income Opportuntiy Fund Shares of Beneficial Interest,$9.35,0.11,1.19%,379060388.00,United States,2004,146308,,
JRS,Nuveen Real Estate Income Fund Common Shares of Beneficial Interest,$9.05,0.17,1.914%,261476863.00,United States,2001,102742,,
JSD,Nuveen Short Duration Credit Opportunities Fund Common Shares of Beneficial Interest,$13.99,0.14,1.011%,141098216.00,United States,2011,21708,,
JT,Jianpu Technology Inc. American depositary shares,$2.15,-0.09,-4.018%,45438502.00,,2017,256743,Technology,Computer Software: Programming Data Processing
JTA,Nuveen Tax-Advantaged Total Return Strategy Fund Common Share of Beneficial Interest,$10.31,0.10,0.979%,142802748.00,United States,2004,110497,,
JTD,Nuveen Tax-Advantaged Dividend Growth Fund Common Shares of Beneficial Interest,$14.52,0.16,1.114%,210312617.00,United States,,92718,,
JW/A,John Wiley & Sons Inc.,$52.97,2.02,3.965%,,United States,,294862,,
JW/B,John Wiley & Sons Inc.,$51.42,0.67,1.32%,,United States,,512,,
JWN,Nordstrom Inc. Common Stock,$35.07,-0.45,-1.267%,5534046000.00,United States,,4395419,Consumer Services,Clothing/Shoe/Accessory Stores
JWS,Jaws Acquisition Corp. Class A Ordinary Shares,$13.40,0.72,5.678%,1155750000.00,,2020,1980221,Health Care,Medical/Nursing Services
K,Kellogg Company Common Stock,$59.24,1.54,2.669%,20375616424.00,United States,,4508922,Consumer Non-Durables,Packaged Foods
KAI,Kadant Inc Common Stock,$175.48,4.93,2.891%,2019697589.00,United States,,57127,Technology,Industrial Machinery/Components
KAMN,Kaman Corporation Common Stock,$53.06,2.62,5.194%,1471415031.00,United States,,170390,Capital Goods,Military/Government/Technical
KAR,KAR Auction Services Inc Common Stock,$14.25,0.44,3.186%,1848253557.00,United States,2009,3219041,Consumer Durables,Automotive Aftermarket
KB,KB Financial Group Inc,$41.63,1.71,4.284%,16428627366.00,South Korea,,332504,Finance,Commercial Banks
KBH,KB Home Common Stock,$42.63,3.10,7.842%,4214006407.00,United States,1986,2497118,Capital Goods,Homebuilding
KBR,KBR Inc. Common Stock,$31.02,0.38,1.24%,4368973559.00,United States,2006,2179061,Basic Industries,Military/Government/Technical
KEN,Kenon Holdings Ltd. Ordinary Shares,$28.698,-0.802,-2.719%,1545994521.00,Singapore,2015,688,Public Utilities,Electric Utilities: Central
KEP,Korea Electric Power Corporation Common Stock,$10.31,-0.04,-0.386%,13237299268.00,South Korea,1994,132709,Public Utilities,Electric Utilities: Central
KEX,Kirby Corporation Common Stock,$64.95,2.31,3.688%,3902520750.00,United States,,475145,Consumer Services,Marine Transportation
KEY,KeyCorp Common Stock,$20.66,0.42,2.075%,20015721040.00,United States,,12799888,Finance,Major Banks
KEY^I,KeyCorp Depositary Shares Each Representing a 1/40th Ownership Interest in a Share of Fixed-to-Floating Rate Perpetual Non-Cumulative Preferred Stock Series E,$28.43,0.58,2.083%,,United States,,26604,,
KEY^J,KeyCorp Depositary Shares each representing a 1/40th ownership interest in a share of Fixed Rate Perpetual Non-Cumulative Preferred Stock Series F,$26.17,0.00,0.00%,,United States,,10059,,
KEY^K,KeyCorp Depositary Shares each representing a 1/40th ownership interest in a share of Fixed Rate Perpetual Non-Cumulative Preferred Stock Series G,$26.61,-0.03,-0.113%,,United States,,38221,,
KEYS,Keysight Technologies Inc. Common Stock,$134.70,2.27,1.714%,25065585518.00,United States,2014,1350694,Capital Goods,Industrial Machinery/Components
KF,Korea Fund Inc. (The) New Common Stock,$42.63,0.16,0.377%,214480866.00,United States,,3717,,
KFS,Kingsway Financial Services Inc. Common Stock (DE),$4.50,0.00,0.00%,102199811.00,Canada,,10181,Finance,Property-Casualty Insurers
KFY,Korn Ferry Common Stock,$61.37,1.50,2.505%,3313795890.00,United States,1999,298998,Technology,Diversified Commercial Services
KGC,Kinross Gold Corporation Common Stock,$6.55,0.10,1.55%,8242520000.00,Canada,,18040503,Basic Industries,Precious Metals
KIM,Kimco Realty Corporation Common Stock,$19.02,0.39,2.093%,8225005376.00,United States,,3720410,Consumer Services,Real Estate Investment Trusts
KIM^L,Kimco Realty Corporation Class L Depositary Shares each of which represents a one-one thousandth fractional interest in a share of 5.125% Class L Cumulative Redeemable Preferred Stock liquidation preference $25000.00 per share,$26.09,0.29,1.124%,,United States,,28618,,
KIM^M,Kimco Realty Corporation Class M Depositary Shares each of which represents a one-one thousandth fractional interest in a share of 5.25% Class M Cumulative Redeemable Preferred Stock liquidation preference $25000.00 per share,$26.13,0.13,0.50%,,United States,,22061,,
KIO,KKR Income Opportunities Fund Common Shares,$15.55,0.30,1.967%,316291898.00,,2013,103988,,
KKR,KKR & Co. Inc. Common Stock,$46.90,0.21,0.45%,27043064061.00,United States,,3369115,Finance,Investment Managers
KKR^A,KKR & Co. Inc. 6.75% Series A Preferred Stock,$25.49,-0.06,-0.235%,,United States,,4479,,
KKR^B,KKR & Co. Inc. 6.50% Series B Preferred Stock,$25.56,0.11,0.432%,,United States,,14370,,
KKR^C,KKR & Co. Inc. 6.00% Series C Mandatory Convertible Preferred Stock,$65.34,-0.07,-0.107%,,United States,,5441,,
KL,Kirkland Lake Gold Ltd. Common Shares,$34.22,0.53,1.573%,9137553649.00,,,1885901,Basic Industries,Precious Metals
KMB,Kimberly-Clark Corporation Common Stock,$131.59,2.91,2.261%,44525308759.00,United States,,2541926,Consumer Durables,Containers/Packaging
KMF,Kayne Anderson NextGen Energy & Infrastructure Inc.,$6.29,0.01,0.159%,296872036.00,,2010,204209,,
KMI,Kinder Morgan Inc. Common Stock,$15.87,0.18,1.147%,35936824991.00,United States,2011,23236350,Public Utilities,Natural Gas Distribution
KMPR,Kemper Corporation,$78.78,2.42,3.169%,5156520084.00,United States,,339170,Finance,Property-Casualty Insurers
KMT,Kennametal Inc. Common Stock,$39.55,1.16,3.022%,3303730269.00,United States,,615990,Capital Goods,Industrial Machinery/Components
KMX,CarMax Inc,$123.20,2.90,2.411%,20025106763.00,United States,,1622367,Consumer Durables,Automotive Aftermarket
KN,Knowles Corporation Common Stock,$20.55,0.29,1.431%,1884977006.00,,2014,693635,Consumer Non-Durables,Consumer Electronics/Appliances
KNL,Knoll Inc. Common Stock,$17.38,0.35,2.055%,880854081.00,United States,2004,261870,Consumer Durables,Office Equipment/Supplies/Services
KNOP,KNOT Offshore Partners LP Common Units representing Limited Partner Interests,$17.79,0.11,0.622%,581627932.00,United Kingdom,2013,128598,Consumer Services,Marine Transportation
KNX,Knight-Swift Transportation Holdings Inc.,$45.32,0.83,1.866%,7507225052.00,United States,2017,2111952,Transportation,Trucking Freight/Courier Services
KO,Coca-Cola Company (The) Common Stock,$50.79,0.85,1.702%,218869940024.00,United States,,21305443,Consumer Non-Durables,Beverages (Production/Distribution)
KODK,Eastman Kodak Company Common New,$7.60,-0.47,-5.824%,595572822.00,United States,,5678481,Miscellaneous,Industrial Machinery/Components
KOF,Coca Cola Femsa S.A.B. de C.V.  American Depositary Shares each representing 10 Units (each Unit consists of 3 Series B Shares and 5 Series L Shares),$46.50,1.07,2.355%,9768894375.00,Mexico,1993,162462,Consumer Non-Durables,Beverages (Production/Distribution)
KOP,Koppers Holdings Inc. Koppers Holdings Inc. Common Stock,$35.45,1.18,3.443%,747943385.00,United States,2006,160555,Basic Industries,Forest Products
KOS,Kosmos Energy Ltd. Common Shares (DE),$3.38,-0.05,-1.458%,1378511108.00,Bermuda,2011,11664656,Energy,Oil & Gas Production
KR,Kroger Company (The) Common Stock,$34.44,0.35,1.027%,26220792746.00,United States,,16960511,Consumer Services,Food Chains
KRA,Kraton Corporation Common Stock,$38.85,0.80,2.102%,1239082794.00,United States,2009,350400,Basic Industries,Major Chemicals
KRC,Kilroy Realty Corporation Common Stock,$64.52,0.26,0.405%,7508134074.00,United States,1997,751684,Consumer Services,Real Estate Investment Trusts
KREF,KKR Real Estate Finance Trust Inc. Common Stock,$18.70,0.12,0.646%,1040083304.00,United States,2017,505503,Consumer Services,Real Estate Investment Trusts
KRG,Kite Realty Group Trust Common Stock,$20.09,0.53,2.71%,1693431704.00,United States,2004,470853,Consumer Services,Real Estate Investment Trusts
KRO,Kronos Worldwide Inc Common Stock,$15.49,0.82,5.59%,1789756686.00,United States,,228995,Basic Industries,Major Chemicals
KRP,Kimbell Royalty Partners Common Units Representing Limited Partner Interests,$10.72,-0.06,-0.557%,644080734.00,United States,2017,113813,Energy,Oil & Gas Production
KSM,DWS Strategic Municipal Income Trust,$11.67,0.00,0.00%,130749991.00,United States,1989,4128,,
KSS,Kohl's Corporation Common Stock,$55.59,0.78,1.423%,8763896638.00,United States,1992,2196717,Consumer Services,Department/Specialty Retail Stores
KSU,Kansas City Southern Common Stock,$211.69,10.38,5.156%,19231580731.00,United States,,885772,Transportation,Railroads
KSU^,Kansas City Southern Preferred Stock,$38.85,0.6401,1.675%,,United States,,25,Transportation,Railroads
KT,KT Corporation Common Stock,$11.63,0.10,0.867%,5531194133.00,South Korea,,1915984,Public Utilities,Telecommunications Equipment
KTB,Kontoor Brands Inc. Common Stock ,$50.70,2.28,4.709%,2900312259.00,,2019,685403,Consumer Non-Durables,Apparel
KTF,DWS Municipal Income Trust,$11.50,0.07,0.612%,454260787.00,United States,1988,52473,,
KTH,Structures Products Cp 8% CorTS Issued by Peco Energy Cap Tr II Preferred Stock,$33.70,0.00,0.00%,0.00,United States,,25,Finance,Finance: Consumer Services
KTN,Structured Products Corp 8.205% CorTS 8.205% Corporate Backed Trust Securities (CorTS),$32.30,0.00,0.00%,0.00,United States,,261,Finance,Finance: Consumer Services
KUKE,Kuke Music Holding Limited American Depositary Shares each representing one Ordinary Share,$5.91,0.265,4.694%,174739333.00,,2021,36366,Consumer Services,Other Consumer Services
KW,Kennedy-Wilson Holdings Inc. Common Stock,$19.74,-0.05,-0.253%,2785005799.00,United States,,611745,Finance,Real Estate
KWAC,Kingswood Acquisition Corp. Class A Common Stock,$10.05,0.05,0.50%,144468750.00,,2021,62088,Finance,Business Services
KWR,Quaker Chemical Corporation Common Stock,$261.04,2.78,1.076%,4659724801.00,United States,,132991,Basic Industries,Major Chemicals
KYN,Kayne Anderson Energy Infrastructure Fund Inc.,$7.13,0.02,0.281%,901571060.00,United States,2004,821576,,
L,Loews Corporation Common Stock,$50.05,1.09,2.226%,13365680228.00,United States,,990851,Finance,Property-Casualty Insurers
LAC,Lithium Americas Corp. Common Shares,$14.91,-0.38,-2.485%,1779861196.00,Canada,,6710663,Basic Industries,Precious Metals
LAD,Lithia Motors Inc. Common Stock,$375.46,17.49,4.886%,9999391893.00,United States,,280657,Consumer Durables,Automotive Aftermarket
LADR,Ladder Capital Corp Class A Common Stock,$11.31,0.01,0.088%,1434399346.00,,2014,1364409,Consumer Services,Real Estate Investment Trusts
LAIX,LAIX Inc. American Depositary Shares each  representing one Class A Ordinary Share,$2.47,0.24,10.762%,122048216.00,,2018,902699,Consumer Services,Other Consumer Services
LAZ,Lazard LTD. Lazard LTD. Class A Common Stock,$40.04,0.45,1.137%,4176141369.00,Bermuda,2005,691115,Finance,Investment Managers
LB,L Brands Inc.,$55.68,1.60,2.959%,15485084788.00,United States,,3472718,Consumer Services,Clothing/Shoe/Accessory Stores
LBRT,Liberty Oilfield Services Inc. Class A Common Stock,$13.62,1.20,9.662%,2445347807.00,United States,2018,1451735,Energy,Oilfield Services/Equipment
LC,LendingClub Corporation Common Stock,$11.00,0.03,0.273%,860559634.00,United States,2014,2079731,Finance,Finance: Consumer Services
LCI,Lannett Co Inc Common Stock,$6.17,0.13,2.152%,255448674.00,United States,,668165,Health Care,Major Pharmaceuticals
LCII,LCI Industries,$134.37,2.61,1.981%,3380624102.00,United States,,197648,Capital Goods,Auto Parts:O.E.M.
LDI,loanDepot Inc. Class A Common Stock,$18.51,0.19,1.037%,2356107192.00,,2021,446908,Finance,Finance: Consumer Services
LDL,Lydall Inc. Common Stock,$37.73,0.80,2.166%,673864063.00,United States,,162993,Capital Goods,Auto Parts:O.E.M.
LDOS,Leidos Holdings Inc. Common Stock,$90.72,1.64,1.841%,12872691992.00,United States,,1449270,Technology,EDP Services
LDP,Cohen & Steers Limited Duration Preferred and Income Fund Inc.,$25.16,-0.03,-0.119%,727382444.00,United States,2012,26781,,
LEA,Lear Corporation Common Stock,$176.72,10.95,6.606%,10623525274.00,United States,,687421,Capital Goods,Auto Parts:O.E.M.
LEAF,Leaf Group Ltd. Common Stock,$5.23,0.19,3.77%,187237405.00,United States,,320193,Technology,EDP Services
LEAP,Ribbit LEAP Ltd. Class A Ordinary Shares,$11.75,-0.75,-6.00%,687433750.00,United States,2020,565556,Finance,Business Services
LEE,Lee Enterprises Incorporated Common Stock,$2.68,-0.32,-10.667%,157488946.00,United States,,1348258,Consumer Services,Newspapers/Magazines
LEG,Leggett & Platt Incorporated Common Stock,$47.34,3.14,7.104%,6295624226.00,United States,,1167848,Consumer Durables,Home Furnishings
LEJU,Leju Holdings Limited American Depositary Shares each representing one Ordinary share,$2.86,0.01,0.351%,389828548.00,,2014,146914,Finance,Real Estate
LEN,Lennar Corporation Class A Common Stock,$85.98,5.56,6.914%,26835794124.00,United States,,4247969,Basic Industries,Homebuilding
LEO,BNY Mellon Strategic Municipals Inc. Common Stock,$8.435,-0.065,-0.765%,524739342.00,United States,1987,98210,,
LEVI,Levi Strauss & Co Class A Common Stock,$24.07,0.16,0.669%,9581299795.00,United States,2019,3015851,Consumer Non-Durables,Apparel
LFC,China Life Insurance Company Limited American Depositary Shares,$10.72,0.15,1.419%,60599538240.00,China,2003,682933,Finance,Life Insurance
LFT,Lument Finance Trust Inc. Common Stock,$3.2933,0.0033,0.10%,82146043.00,United States,2013,59952,Consumer Services,Real Estate Investment Trusts
LGI,Lazard Global Total Return and Income Fund Common Stock,$18.52,-0.14,-0.75%,240938922.00,United States,2004,66732,,
LH,Laboratory Corporation of America Holdings Common Stock,$237.80,2.90,1.235%,23209280000.00,United States,,661376,Health Care,Medical Specialities
LHC,Leo Holdings Corp. II Class A Ordinary Shares,$9.81,-0.05,-0.507%,,,2021,10503,Finance,Business Services
LHX,L3Harris Technologies Inc. Common Stock,$187.09,3.36,1.829%,38459302154.00,United States,,1150006,Capital Goods,Industrial Machinery/Components
LII,Lennox International Inc. Common Stock,$283.08,4.69,1.685%,10681617580.00,United States,1999,447096,Capital Goods,Industrial Machinery/Components
LIN,Linde plc Ordinary Share,$247.64,2.22,0.905%,129475212287.00,,2018,2136267,Basic Industries,Major Chemicals
LINX,Linx S.A. American Depositary Shares each representing one common share,$6.75,-0.01,-0.148%,1185929255.00,,2019,32441,Technology,Computer Software: Prepackaged Software
LITB,LightInTheBox Holding Co. Ltd. American Depositary Shares each representing 2 ordinary shares,$3.35,0.12,3.715%,374448180.00,China,2013,714240,Consumer Services,Catalog/Specialty Distribution
LL,Lumber Liquidators Holdings Inc Common Stock,$23.55,0.78,3.426%,679999397.00,United States,2007,927361,Consumer Services,RETAIL: Building Materials
LLY,Eli Lilly and Company Common Stock,$206.92,6.38,3.181%,198317444396.00,United States,,3875864,Health Care,Major Pharmaceuticals
LMND,Lemonade Inc. Common Stock,$92.90,-2.90,-3.027%,5257260144.00,United States,2020,6068607,Finance,Property-Casualty Insurers
LMT,Lockheed Martin Corporation Common Stock,$340.43,2.18,0.644%,95355611015.00,United States,,1450654,Capital Goods,Military/Government/Technical
LNC,Lincoln National Corporation Common Stock,$58.57,1.83,3.225%,11242996518.00,United States,,1605205,Finance,Life Insurance
LND,Brasilagro Brazilian Agric Real Estate Co Sponsored ADR (Brazil),$4.11,-0.09,-2.143%,325441822.00,Brazil,,8496,Consumer Non-Durables,Farming/Seeds/Milling
LNFA,L&amp;F Acquisition Corp. Class A Ordinary Shares,$9.98,0.07,0.706%,0.00,United States,2021,62987,Finance,Business Services
LNN,Lindsay Corporation Common Stock,$159.34,3.75,2.41%,1731268298.00,United States,,118507,Capital Goods,Industrial Machinery/Components
LOKB,Live Oak Acquisition Corp. II Class A Common Stock,$10.14,0.12,1.198%,320677500.00,,2021,656945,Finance,Business Services
LOMA,Loma Negra Compania Industrial Argentina Sociedad Anonima ADS,$5.21,-0.17,-3.16%,621059092.00,Argentina,2017,656687,Capital Goods,Building Materials
LOW,Lowe's Companies Inc. Common Stock,$158.58,4.81,3.128%,115921980000.00,United States,,5140225,Consumer Services,RETAIL: Building Materials
LPG,Dorian LPG Ltd. Common Stock,$12.99,0.51,4.087%,648032000.00,,2014,693099,Transportation,Marine Transportation
LPI,Laredo Petroleum Inc. Common Stock,$34.24,0.13,0.381%,411536586.00,United States,2011,930735,Energy,Oil & Gas Production
LPL,LG Display Co Ltd AMERICAN DEPOSITORY SHARES,$10.05,0.30,3.077%,7192095570.00,South Korea,2004,641360,Capital Goods,Industrial Machinery/Components
LPX,Louisiana-Pacific Corporation Common Stock,$48.43,2.26,4.895%,5158080543.00,United States,,1380856,Basic Industries,Forest Products
LRN,Stride Inc. Common Stock,$24.79,0.43,1.765%,1031324810.00,United States,,488146,Consumer Services,Other Consumer Services
LSI,Life Storage Inc. Common Stock,$82.26,0.59,0.722%,6207524356.00,United States,,622891,Consumer Services,Real Estate Investment Trusts
LSPD,Lightspeed POS Inc. Subordinate Voting Shares,$58.46,-2.77,-4.524%,6948792772.00,,,2204944,Technology,Computer Software: Prepackaged Software
LTC,LTC Properties Inc. Common Stock,$42.16,0.77,1.86%,1654452206.00,United States,,196523,Consumer Services,Real Estate Investment Trusts
LTHM,Livent Corporation Common Stock,$16.70,-0.33,-1.938%,2444245083.00,United States,2018,4219250,Basic Industries,Major Chemicals
LU,Lufax Holding Ltd American Depositary Shares two of which representing one Ordinary Share,$15.21,-0.05,-0.328%,37084200538.00,China,2020,6257794,Finance,Finance: Consumer Services
LUB,Luby's Inc. Common Stock,$3.27,0.00,0.00%,100526281.00,United States,,263095,Consumer Services,Restaurants
LUMN,Lumen Technologies Inc. Common Stock,$13.47,0.05,0.373%,14774550211.00,United States,,13577019,Public Utilities,Telecommunications Equipment
LUV,Southwest Airlines Company Common Stock,$56.92,0.84,1.498%,33621361820.00,United States,,11416632,Transportation,Air Freight/Delivery Services
LVS,Las Vegas Sands Corp. Common Stock,$62.44,0.09,0.144%,47694353049.00,United States,2004,10437930,Consumer Services,Hotels/Resorts
